{
  "domain": "food-parcel-regulation",
  "version": 2,
  "actors": [
    "食品协议客户",
    "快递网点人员",
    "邮政管理人员",
    "市场监管人员"
  ],
  "facts": [
    "食品寄递同时受实名、验视和安检要求约束",
    "首次揽件可通过专属核验码按生效区间核验经营资质、经营场所、外设仓库和地址",
    "揽件验视只留存当时所见的证照摘要、货物类别、温控条件和位置，不留存证照影像原件",
    "网点设备离线重传时，相同流水相同报文幂等、相同流水异文进入隔离",
    "地址不符、证照过期、包装异常、温控中断按各自生效规则版本形成不同级别线索",
    "寄递企业可暂停未发出包裹，核查、放行、立案由市场监管人员独立决定，上报人不能处置自己的线索",
    "监管部门之间需要信息互通、线索互移、处置互助和完整可追溯的交接时间线",
    "风险扩大只波及实际关联批次中的未决件，已妥投事实保留并转为通知责任",
    "温控时限、待核查事项和回执催办不依赖进程内计时，重启后由事件状态重建并继续"
  ],
  "constraints": [
    "资质时态核验：客户资质、经营场所、外设仓库、核验码、规则书均按[valid_from, valid_to)生效区间查询",
    "揽件事件幂等：相同流水不得生成第二次揽件，异文隔离",
    "风险线索分级：四类线索依据事件发生时点的规则版本定级，版本号随线索固化",
    "跨部门移交：线索处置职权分离，移交带回执时限与完整时间线",
    "在途影响传播：仅波及关联批次的未发出/在途件，妥投转通知、退回归原链路、投诉归关联线索",
    "包裹决定一致：企业暂停与监管冻结单一槽位互斥，旧决定不得覆盖新状态，放行与冻结不得并存",
    "原子提交：一次业务动作跨聚合事件同进同退，重启后状态完整恢复"
  ]
}
